{
  "type": "offer",
  "offer_id": "22222222-2222-4222-8222-222222222222",
  "issuer_ref": "did:web:driver-app.example.com:agent:driver-123",
  "category_ref": "intercity_travel",
  "grouping_keys": {
    "source_region": "Pune",
    "destination_region": "Kolhapur",
    "start_time_bucket": "2026-07-18T15:00/17:00+05:30"
  },
  "capacity": { "unit": "seat", "quantity": 3 },
  "price_terms": {
    "negotiable": true,
    "current": { "amount_minor": 55000, "currency": "INR" }
  },
  "category_ext": {
    "route": [
      { "stop": "Pune", "eta": "2026-07-18T15:30:00+05:30" },
      { "stop": "Satara", "eta": "2026-07-18T17:00:00+05:30", "price_per_seat": { "amount_minor": 38000, "currency": "INR" } },
      { "stop": "Ichalkaranji", "eta": "2026-07-18T19:00:00+05:30", "price_per_seat": { "amount_minor": 52000, "currency": "INR" } },
      { "stop": "Kolhapur", "eta": "2026-07-18T19:30:00+05:30", "price_per_seat": { "amount_minor": 55000, "currency": "INR" } }
    ],
    "vehicle": { "kind": "sedan", "verified": true }
  },
  "hold_expires_at": "2026-07-17T15:40:00+05:30",
  "attestation_refs": ["cccccccc-cccc-4ccc-8ccc-cccccccccccc"],
  "created_at": "2026-07-17T08:00:00+05:30"
}
